{
    "skills": [
        {
            "id": "auditing-security-and-privacy",
            "metadata": {
                "risk": "read",
                "autonomy": "autonomous",
                "category": "assurance",
                "depends_on": [
                    "designing-system-architecture",
                    "designing-data-and-authorization",
                    "managing-secrets-and-config"
                ],
                "capabilities": [
                    "security-privacy",
                    "governance",
                    "verification"
                ],
                "lifecycle_phase": "all"
            },
            "entrypoint": ".agents/skills/auditing-security-and-privacy/SKILL.md",
            "source_system": "agents",
            "classification": "foundation"
        },
        {
            "id": "building-agents-and-automations",
            "metadata": {
                "risk": "reversible-write",
                "autonomy": "autonomous-with-verification",
                "category": "engineering",
                "depends_on": [
                    "designing-system-architecture",
                    "threat-modeling-autonomous-actions"
                ],
                "capabilities": [
                    "agents-automations",
                    "governance",
                    "repair"
                ],
                "lifecycle_phase": "horizontal-growth"
            },
            "entrypoint": ".agents/skills/building-agents-and-automations/SKILL.md",
            "source_system": "agents",
            "classification": "foundation"
        },
        {
            "id": "building-applications",
            "metadata": {
                "risk": "reversible-write",
                "autonomy": "autonomous-with-verification",
                "category": "engineering",
                "depends_on": [
                    "designing-system-architecture",
                    "designing-data-and-authorization"
                ],
                "capabilities": [
                    "app-build",
                    "technical-alpha",
                    "source-provenance"
                ],
                "lifecycle_phase": "focused-entry"
            },
            "entrypoint": ".agents/skills/building-applications/SKILL.md",
            "source_system": "agents",
            "classification": "foundation"
        },
        {
            "id": "capturing-outcome-telemetry",
            "metadata": {
                "risk": "reversible-write",
                "autonomy": "autonomous-with-verification",
                "category": "learning-data",
                "depends_on": [
                    "designing-system-architecture",
                    "auditing-security-and-privacy"
                ],
                "capabilities": [
                    "outcome-data",
                    "memory",
                    "evaluations"
                ],
                "lifecycle_phase": "horizontal-growth"
            },
            "entrypoint": ".agents/skills/capturing-outcome-telemetry/SKILL.md",
            "source_system": "agents",
            "classification": "foundation"
        },
        {
            "id": "defining-focused-entry-wedges",
            "metadata": {
                "risk": "read",
                "autonomy": "autonomous",
                "category": "business-validation",
                "depends_on": [
                    "validating-customer-problems"
                ],
                "capabilities": [
                    "focused-entry",
                    "customer-validation",
                    "strategy"
                ],
                "lifecycle_phase": "focused-entry"
            },
            "entrypoint": ".agents/skills/defining-focused-entry-wedges/SKILL.md",
            "source_system": "agents",
            "classification": "foundation"
        },
        {
            "id": "delivering-enterprise-governance",
            "metadata": {
                "risk": "high-risk",
                "autonomy": "approval-before-side-effect",
                "category": "enterprise-ecosystem",
                "depends_on": [
                    "sequencing-platform-expansion",
                    "auditing-security-and-privacy",
                    "preserving-audit-lineage"
                ],
                "capabilities": [
                    "enterprise",
                    "governance",
                    "security-privacy"
                ],
                "lifecycle_phase": "enterprise"
            },
            "entrypoint": ".agents/skills/delivering-enterprise-governance/SKILL.md",
            "source_system": "agents",
            "classification": "foundation"
        },
        {
            "id": "deploying-with-exact-provenance",
            "metadata": {
                "risk": "high-risk",
                "autonomy": "approval-before-side-effect",
                "category": "delivery-runtime",
                "depends_on": [
                    "managing-environments",
                    "testing-software-end-to-end",
                    "preserving-source-provenance",
                    "managing-approvals-and-risk"
                ],
                "capabilities": [
                    "deployment",
                    "source-provenance",
                    "governance"
                ],
                "lifecycle_phase": "all"
            },
            "entrypoint": ".agents/skills/deploying-with-exact-provenance/SKILL.md",
            "source_system": "agents",
            "classification": "foundation"
        },
        {
            "id": "designing-data-and-authorization",
            "metadata": {
                "risk": "read",
                "autonomy": "autonomous",
                "category": "engineering",
                "depends_on": [
                    "designing-system-architecture"
                ],
                "capabilities": [
                    "data-auth",
                    "security-privacy",
                    "migrations"
                ],
                "lifecycle_phase": "all"
            },
            "entrypoint": ".agents/skills/designing-data-and-authorization/SKILL.md",
            "source_system": "agents",
            "classification": "foundation"
        },
        {
            "id": "designing-mobile-accessible-experiences",
            "metadata": {
                "risk": "reversible-write",
                "autonomy": "autonomous-with-verification",
                "category": "product-experience",
                "depends_on": [
                    "translating-intent-to-specifications",
                    "designing-simple-and-pro-modes"
                ],
                "capabilities": [
                    "mobile-ux",
                    "accessibility",
                    "verification"
                ],
                "lifecycle_phase": "all"
            },
            "entrypoint": ".agents/skills/designing-mobile-accessible-experiences/SKILL.md",
            "source_system": "agents",
            "classification": "foundation"
        },
        {
            "id": "designing-simple-and-pro-modes",
            "metadata": {
                "risk": "read",
                "autonomy": "autonomous",
                "category": "product-experience",
                "depends_on": [
                    "translating-intent-to-specifications",
                    "defining-focused-entry-wedges"
                ],
                "capabilities": [
                    "product",
                    "simple-mode",
                    "professional-mode"
                ],
                "lifecycle_phase": "all"
            },
            "entrypoint": ".agents/skills/designing-simple-and-pro-modes/SKILL.md",
            "source_system": "agents",
            "classification": "foundation"
        },
        {
            "id": "designing-skills-and-connectors",
            "metadata": {
                "risk": "reversible-write",
                "autonomy": "autonomous-with-verification",
                "category": "enterprise-ecosystem",
                "depends_on": [
                    "designing-system-architecture",
                    "planning-governed-actions"
                ],
                "capabilities": [
                    "skills",
                    "integrations",
                    "evaluations"
                ],
                "lifecycle_phase": "horizontal-growth"
            },
            "entrypoint": ".agents/skills/designing-skills-and-connectors/SKILL.md",
            "source_system": "agents",
            "classification": "foundation"
        },
        {
            "id": "designing-system-architecture",
            "metadata": {
                "risk": "read",
                "autonomy": "autonomous",
                "category": "engineering",
                "depends_on": [
                    "translating-intent-to-specifications",
                    "planning-governed-actions"
                ],
                "capabilities": [
                    "architecture",
                    "governance",
                    "runtime"
                ],
                "lifecycle_phase": "all"
            },
            "entrypoint": ".agents/skills/designing-system-architecture/SKILL.md",
            "source_system": "agents",
            "classification": "foundation"
        },
        {
            "id": "evaluating-unit-economics",
            "metadata": {
                "risk": "read",
                "autonomy": "autonomous",
                "category": "business-validation",
                "depends_on": [
                    "running-paid-pilot-validation",
                    "measuring-activation-and-retention"
                ],
                "capabilities": [
                    "unit-economics",
                    "pricing",
                    "runtime-cost"
                ],